{
  "schema_version": "vector-asset/v1",
  "asset_id": "ship_test_01",
  "category": "ship",
  "primary_polygon": [[0, -28], [18, 22], [0, 12], [-18, 22]],
  "fill_color": [0.9, 0.95, 1.0, 1.0],
  "collision": {
    "type": "convex_polygon",
    "polygon": [[0, -28], [18, 22], [-18, 22]]
  },
  "requires_symmetry": true,
  "tags": ["test", "ship"],
  "provenance": {
    "generator": "manual",
    "model": "none",
    "prompt_file": "unknown",
    "prompt_revision": "test",
    "created_at": "2026-08-03",
    "seed": null,
    "manual_edits": "Test fixture.",
    "source_license": "project-owned",
    "notes": "Valid ship fixture."
  },
  "approval": {
    "status": "approved",
    "reviewer": "test"
  }
}
