{
  "schema_version": "vector-asset/v1",
  "asset_id": "bullet_baseline_01",
  "category": "bullet",
  "primary_polygon": [[0, -8], [6, 0], [0, 8], [-6, 0]],
  "fill_color": [1.0, 0.95, 0.42, 1.0],
  "collision": {
    "type": "circle",
    "radius": 5
  },
  "tags": ["baseline", "projectile"],
  "provenance": {
    "generator": "manual",
    "model": "none",
    "prompt_file": "unknown",
    "prompt_revision": "8749a81",
    "created_at": "2026-08-03",
    "seed": null,
    "manual_edits": "Copied from the baseline Bullet Polygon2D and circle collision shape.",
    "source_license": "project-owned",
    "notes": "Baseline approved source for the current bullet visual."
  },
  "approval": {
    "status": "approved",
    "reviewer": "japurane"
  }
}
